case_id,revision,priority,question,expected_intent,expected_mode,expected_evidence_signal,status,notes
FY-001,1,P0,در دیتابیس چند سال مالی وجود داره؟,count_fiscal_years,deterministic,table_or_row_count,active,Validated live on 2026-06-13; baseline stable
SLS-001,1,P1,تنخواه پرداختی شرکت هوشمندسازان ارتباطات در سال مالی 1404 چقدر هستش,financial_lookup_by_company_fiscal_year,complex_join,numeric_result_with_company_filter,blocked,Complex schema: needs Party + FiscalYear + payment detail join; loop limit reached
INV-001,1,P1,لیست تمام فاکتورهای صادر شده در سال 1403 را بیاور,list_transactions_by_fiscal_year,deterministic,invoice_count_or_table,active_testing,Uses SLS.Invoice + FiscalYear join; passes after schema cache fix expected
ITM-001,1,P1,کالاهایی که در سال 1403 فروخته نشده‌اند کدام‌ند؟,identify_unsold_items_in_period,complex_join,item_list_with_count,blocked,Requires nested subquery (NOT IN); loop limit + schema mismatch (Invalid column 'Name')
RCT-001,1,P2,فیش‌های دریافتی بین 1 فروردین تا 30 اردیبهشت 1402 چند عدد هستند,count_transactions_by_date_range,deterministic,receipt_count,pending,Schema lookup for RPA.ReceiptHeader passes; fetch may timeout
INV-002,1,P1,محاسبه کنید در بین صادرات فاکتورهای سال 1403 کدام ماه بیشترین نوسان فروش داشته است,monthly_sales_variance_analysis,complex_aggregate,fluctuation_result_with_month,blocked,Requires LAG window function; not supported in SQL Server 2019 target (EREQUEST); needs alternative CROSS JOIN approach
